s,27403
e,17677
i n g,4411
e r,4266
e d,4247
t,3400
i,3201
l y,2135
y,1590
n e s s,979
a l,927
n,873
r,790
d,679
l,607
i c,604
a,603
i o n,538
f u l,451
c,422
a t i o n,404
l e s s,359
a t e,356
o u s,351
i z e,344
i s t,299
g,272
f,264
a b l e,252
k,243
m e n t,240
i v e,230
o r,223
i t y,204
i s h,200
i s m,149
t h,147
m a n,134
h o u s e,129
a g e,129
m e n,128
o,124
v e,121
i z i n g,112
i z a t i o n,100
i t i e s,91
a b l y,90
h e a d,82
w a y,74
l i n e,73
r o o m,72
a n t,72
b o a r d,71
b o o k,67
s h i p,62
u s,58
p e d,58
a n c e,58
u a l,57
u p,55
p i n g,54
u r e,53
b e d,50
w o r k,46
h e a r t e d,46
x,41
s t o n e,40
g r a p h,39
b e r,39
m i n d e d,36
i f i c a t i o n,35
b a c k,35
u r,34
i a n,34
' s,32
t i m e,31
i f i e d,31
b o y,31
b i n g,31
i f y i n g,29
i f y,29
i f i e s,29
i b l e,29
b o x e s,29
b o x,29
' t,29
l i g h t,28
b a l l,27
s o m e,26
p e r s,26
p e r,26
j a c k,26
s t i c k,23
s k i n,22
w o m e n,21
w o m a n,21
l a n d,21
c a k e,21
' d,21
p i n,20
f a c e,20
a b i l i t y,20
s e q u e n t,18
a d e,18
w o o d,17
b o n e,17
' l l,17
t a i l,16
o u t,16
d o m,16
t r e e s,15
t r e e,15
d a y s,15
d a y,15
c l o t h,15
s i d e,14
m e d,14
l i k e,14
h o l e s,14
h o l e,14
c a t,14
b o a t s,14
b o a t,14
p o i n t s,13
p o i n t,13
p l a t e,13
i b i l i t y,13
' v e,13
p r o o f,12
p o t s,12
p l a c e,12
n u t s,12
n u t,12
m i n g,12
i b l y,12
c u t,12
a t i v e,12
' r e,12
u m,11
p o t,11
m e r,11
l o c k,11
f a l l,11
b y,11
b o u n d,11
b l e,11
a t o r y,11
s o n g,10
p o s t s,10
p o s t,10
m i l l s,10
m i l l,10
h o o d,10
b a g s,10
b a g,10
y a r d s,9
y a r d,9
u o u s,9
u d e,9
t i d e,9
s a w,9
r o a d,9
n a i l,9
m a s t e r s,9
m a s t e r,9
i r o n,9
h o r s e s,9
h o r s e,9
g u n s,9
g u n,9
f l i e s,9
v i n g,8
t o n e,8
s t a n d s,8
s t a n d,8
s h o p s,8
s h o p,8
p y,8
p o l e s,8
p o l e,8
p i t s,8
p i t,8
m o s t,8
k e e p e r s,8
k e e p e r,8
g i r l s,8
g i r l,8
c a p s,8
c a p,8
b l y,8
b a r s,8
b a r,8
b a n d s,8
b a n d,8
a n c y,8
w i r e,7
w a t e r,7
s t o r m s,7
s t o r m,7
p i p e s,7
p i p e,7
p i e c e s,7
p i e c e,7
p a p e r,7
n o s e d,7
l a m p s,7
l a m p,7
k n i v e s,7
k n i f e,7
i v i t y,7
h a n d e d,7
h a n d,7
g l a s s e s,7
f l o w e r s,7
f l o w e r,7
f i e l d s,7
f i e l d,7
e w,7
c o a t s,7
c o a t,7
c h a i r s,7
c h a i r,7
c a s e s,7
c a s e,7
w i s e,6
w a r d s,6
w a r d,6
s i g h t e d,6
s h e l l s,6
s h e l l,6
r o d s,6
r o d,6
p i e s t,6
p i e r,6
o l o g y,6
m y,6
m a r k s,6
m a r k,6
m a k e r s,6
m a k e r,6
f o r m i t y,6
f o o t e d,6
d r o p s,6
d r o p,6
d r i e d,6
d o g s,6
d o g,6
b i r d s,6
b i r d,6
b e a r e r s,6
b e a r e r,6
w o r m s,5
w o r m,5
w i t t e d,5
w i n g s,5
w i n g,5
w a r e,5
v a b l e,5
t o p s,5
t o p,5
t h e r a p y,5
t h e r a p i s t s,5
t h e r a p i s t,5
t c h e r s,5
t c h e r,5
s p o k e n,5
s m i t h s,5
s m i t h,5
s h o t,5
s e l f,5
r e a d e r s,5
r e a d e r,5
p h o n i c,5
p e n n y,5
p a n s,5
p a n,5
o u g h t,5
m o n g e r s,5
m o n g e r,5
m a t e s,5
m a t e,5
m a k i n g,5
m a c h i n e s,5
m a c h i n e,5
i t u d e,5
i g i b l e,5
h a n g e r s,5
h a n g e r,5
h,5
g r o u n d s,5
g r o u n d,5
g o e r s,5
g o e r,5
g a r d e n s,5
g a r d e n,5
f o o t,5
f l a s h e s,5
f l a s h,5
e s q u e,5
d r y i n g,5
d o w n,5
c r a f t,5
c o c k s,5
c o c k,5
b l o o d e d,5
b i e s t,5
b i e r,5
b e l l s,5
w o r t h y,4
w o r d s,4
w o r d,4
w h e r e,4
w h e e l s,4
w h e e l,4
w e i g h t s,4
w e i g h t,4
w e e d,4
w a t c h e s,4
w a t c h,4
w a l k e r s,4
w a l k e r,4
u l a r,4
t e m p e r e d,4
t a x e s,4
t a x,4
s u i t s,4
s u i t,4
s t u f f,4
s t r o k e,4
s t o o l s,4
s t o o l,4
s t e p s,4
s t e p,4
s m,4
s h o e s,4
s h o e,4
s e q u e n c e,4
s c r e w s,4
s c r e w,4
r u n s,4
r u n,4
r e a d i n g,4
r a i l s,4
r a i l,4
r a c e s,4
r a c e,4
p s,4
p l a n e s,4
p l a n e,4
p h o n e s,4
p h o n e,4
p e n c e s,4
p e n c e,4
p a t h s,4
p a t h,4
p a r t y,4
p a r t i e s,4
p,4
o i l,4
n i g h t,4
n e c k e d,4
m s,4
m o r e,4
m o n e y,4
m i e s t,4
m i e r,4
m e t e r s,4
m e t e r,4
m,4
l o n g,4
l o g y,4
l o g i s t s,4
l o g i s t,4
l o g i e s,4
l o g i c a l,4
l i f e,4
l e a f,4
j o i n t,4
i c i d e s,4
i c i d e,4
h o r n s,4
h o r n,4
h o o k s,4
h o o k,4
g u a r d s,4
g u a r d,4
g o i n g,4
g l a s s,4
f o r m i s t s,4
f o r m i s t,4
f o l d,4
f i r e,4
f i n a l s,4
f i n a l,4
e h o l d e r s,4
e h o l d e r,4
c o u r s e,4
c o r n,4
c o n s c i o u s,4
c o n d u c t o r s,4
c o n d u c t o r,4
c o l l e c t o r s,4
c o l l e c t o r,4
c l u b s,4
c l u b,4
b r u s h,4
b r e a k s,4
b r e a k e r s,4
b r e a k e r,4
b r e a k,4
b o w l s,4
b o w l,4
b l a c k,4
b i l l s,4
b i l l,4
b i l i t y,4
b e s t,4
b e l l,4
b e a t e r s,4
b e a t e r,4
b a t h s,4
b a t h,4
a i r e s,4
a i r e,4
w s,3
w o r t h i n e s s,3
w e a r,3
w,3
u t i o n,3
u a t i n g,3
u a t e s,3
u a t e d,3
u a t e,3
t y p e s,3
t y p e,3
t r o p i c a l,3
t r a c k s,3
t r a c k,3
t e m p o r a n e o u s l y,3
t e m p o r a n e o u s,3
t e e t h,3
t a k i n g,3
